{
  "$schema": "https://json-schema.org/draft/2020-12/schema",
  "$id": "https://example.invalid/reporead/report.schema.json",
  "title": "RepoRead Report",
  "type": "object",
  "additionalProperties": false,
  "required": [
    "schema_version",
    "root",
    "summary",
    "findings"
  ],
  "properties": {
    "schema_version": {
      "type": "string",
      "const": "1.0"
    },
    "root": {
      "type": "string"
    },
    "summary": {
      "type": "object",
      "additionalProperties": false,
      "required": [
        "error_count",
        "warning_count",
        "info_count",
        "passed_rule_count",
        "failed_rule_count"
      ],
      "properties": {
        "error_count": {
          "type": "integer",
          "minimum": 0
        },
        "warning_count": {
          "type": "integer",
          "minimum": 0
        },
        "info_count": {
          "type": "integer",
          "minimum": 0
        },
        "passed_rule_count": {
          "type": "integer",
          "minimum": 0
        },
        "failed_rule_count": {
          "type": "integer",
          "minimum": 0
        }
      }
    },
    "findings": {
      "type": "array",
      "items": {
        "type": "object",
        "additionalProperties": false,
        "required": [
          "rule_id",
          "severity",
          "title",
          "detail",
          "path",
          "evidence",
          "suggestion"
        ],
        "properties": {
          "rule_id": {
            "type": "string",
            "minLength": 1
          },
          "severity": {
            "enum": [
              "error",
              "warning",
              "info"
            ]
          },
          "title": {
            "type": "string"
          },
          "detail": {
            "type": "string"
          },
          "path": {
            "type": [
              "string",
              "null"
            ]
          },
          "evidence": {
            "type": [
              "string",
              "null"
            ]
          },
          "suggestion": {
            "type": "string"
          }
        }
      }
    }
  }
}
